{
  "claimId": "CLAIM-2026-0100",
  "claimType": "observation",
  "statement": "API response latency p99 is under 200ms for the payments service in us-east-1",
  "source": "apm-monitor-payments-001",
  "provenance": [
    {"type": "claim", "ref": "CLAIM-2026-0100", "role": "root_assertion"},
    {"type": "evidence", "ref": "evd-apm-2026-0100", "role": "primary_evidence"},
    {"type": "source", "ref": "apm-monitor-payments-001", "role": "primary_source"}
  ],
  "confidence": 0.95,
  "createdAt": "2026-03-01T10:00:00Z",
  "expiresAt": "2026-03-02T10:00:00Z",
  "status": "active",
  "supports": [],
  "contradicts": [],
  "tags": ["latency", "payments", "us-east-1", "sla"],
  "metadata": {"region": "us-east-1", "service": "payments"}
}
